term,normalized_term,suggested_abbreviation,word_count,frequency,abbreviation_found_in_text,found_abbreviation,match_score,examples
система управления доступом,система управление доступ,СУД,3,2,True,СУД,100.0,"В подсистеме контроля используется система управления доступом (СУД), которая разграничивает права операторов и администраторов. || СУД — система управления доступом"
центр обработки данных,центр обработка данные,ЦОД,3,2,True,ЦОД,100.0,Для хранения архивов применяется ЦОД (центр обработки данных). || ЦОД — центр обработки данных
центр оперативной обработки сообщений,центр оперативной обработки сообщений,ЦООС,4,1,True,ЦООС,100.0,"В сноске дополнительно указан центр оперативной обработки сообщений (ЦООС), который используется для маршрутизации уведомлений."
Автоматизированная система мониторинга событий,автоматизированный система мониторинг событие,АСМС,4,4,False,,0.0,Автоматизированная система мониторинга событий фиксирует действия пользователей и сохраняет журнал инцидентов. || Автоматизированная система мониторинга событий используется в модуле аудита. || При тестировании автоматизированная система мониторинга событий показала устойчивую работу.
Распределённая база пользовательских профилей,распределённый база пользовательский профиль,РБПП,4,4,False,,0.0,"Распределённая база пользовательских профилей синхронизируется между узлами. || Позднее распределённая база пользовательских профилей используется для персонализации интерфейса. || Если распределённая база пользовательских профилей упоминается многократно, для неё также можно рекомендовать сокращение."
